{
  "schemaVersion": "1.0",
  "snapshotId": "XSHE.000807__operating__20261025-legacy-v1",
  "securityId": "XSHE.000807",
  "dataset": "operating",
  "asOf": "2026-10-25",
  "collectedAt": "2026-10-25",
  "acceptance": "accepted",
  "createdBy": "codex/legacy-archive",
  "supersedes": null,
  "notes": "仅接受归档结构及可追溯性；所有观测仍unreviewed。period是归档观察日而非财务期；原期间见dimensions，未经原件复核不得称新事实。",
  "observations": [
    {"id":"companystatus_0","metric":"companystatus_0","value":null,"rawValue":"2026H1营业收入349.81亿元、同比+20.30%；归母净利润76.84亿元、同比+177.61%；扣非归母净利润76.19亿元。基本EPS 2.22元，盈利改善主要来自铝产业高景气与经营降本，不能机械外推。","textValue":"2026H1营业收入349.81亿元、同比+20.30%；归母净利润76.84亿元、同比+177.61%；扣非归母净利润76.19亿元。基本EPS 2.22元，盈利改善主要来自铝产业高景气与经营降本，不能机械外推。","unit":"source_text","currency":null,"period":{"kind":"instant","start":null,"end":"2026-10-25"},"basis":{"scope":"legacy_as_stated","accountingStandard":"unknown","adjustment":"unknown","shareBasis":"unknown"},"nature":"legacy_claim","verification":"unreviewed","precision":"as_reported","missingReason":null,"sourceRefs":[{"sourceId":"legacy-project-XSHE.000807-20261025","locator":"/companyStatus/0"}],"notes":"归档截止日不是财务报告期；实际期间原文见dimensions.periodLabel。未复核原件，不自动用作估值参数。","dimensions":{"label":"companyStatus","periodLabel":"2026H1","kind":"legacy_context"}},
    {"id":"companystatus_1","metric":"companystatus_1","value":null,"rawValue":"H1经营现金流83.77亿元，同比增长125%；购建长期资产现金支出约2.06亿元。该支出仅是现金流量表当期项目，不等于全部未来维护与扩张资本开支。","textValue":"H1经营现金流83.77亿元，同比增长125%；购建长期资产现金支出约2.06亿元。该支出仅是现金流量表当期项目，不等于全部未来维护与扩张资本开支。","unit":"source_text","currency":null,"period":{"kind":"instant","start":null,"end":"2026-10-25"},"basis":{"scope":"legacy_as_stated","accountingStandard":"unknown","adjustment":"unknown","shareBasis":"unknown"},"nature":"legacy_claim","verification":"unreviewed","precision":"as_reported","missingReason":null,"sourceRefs":[{"sourceId":"legacy-project-XSHE.000807-20261025","locator":"/companyStatus/1"}],"notes":"归档截止日不是财务报告期；实际期间原文见dimensions.periodLabel。未复核原件，不自动用作估值参数。","dimensions":{"label":"companyStatus","periodLabel":"2026H1","kind":"legacy_context"}},
    {"id":"companystatus_2","metric":"companystatus_2","value":null,"rawValue":"年产氧化铝140万吨、电解铝308万吨、阳极炭素80万吨、绿色铝合金161万吨；H1生产氧化铝65.06万吨、铝商品162.16万吨。报告期绿色能源用电约88%。","textValue":"年产氧化铝140万吨、电解铝308万吨、阳极炭素80万吨、绿色铝合金161万吨；H1生产氧化铝65.06万吨、铝商品162.16万吨。报告期绿色能源用电约88%。","unit":"source_text","currency":null,"period":{"kind":"instant","start":null,"end":"2026-10-25"},"basis":{"scope":"legacy_as_stated","accountingStandard":"unknown","adjustment":"unknown","shareBasis":"unknown"},"nature":"legacy_claim","verification":"unreviewed","precision":"as_reported","missingReason":null,"sourceRefs":[{"sourceId":"legacy-project-XSHE.000807-20261025","locator":"/companyStatus/2"}],"notes":"归档截止日不是财务报告期；实际期间原文见dimensions.periodLabel。未复核原件，不自动用作估值参数。","dimensions":{"label":"companyStatus","periodLabel":"2026H1","kind":"legacy_context"}},
    {"id":"companystatus_3","metric":"companystatus_3","value":null,"rawValue":"2026年中期拟每10股派8.87元（含税），合计约30.76亿元，占H1归母利润约40%；9月22日股东会已审议通过，截至研究日尚未核实实施公告或除权日。","textValue":"2026年中期拟每10股派8.87元（含税），合计约30.76亿元，占H1归母利润约40%；9月22日股东会已审议通过，截至研究日尚未核实实施公告或除权日。","unit":"source_text","currency":null,"period":{"kind":"instant","start":null,"end":"2026-10-25"},"basis":{"scope":"legacy_as_stated","accountingStandard":"unknown","adjustment":"unknown","shareBasis":"unknown"},"nature":"legacy_claim","verification":"unreviewed","precision":"as_reported","missingReason":null,"sourceRefs":[{"sourceId":"legacy-project-XSHE.000807-20261025","locator":"/companyStatus/3"}],"notes":"归档截止日不是财务报告期；实际期间原文见dimensions.periodLabel。未复核原件，不自动用作估值参数。","dimensions":{"label":"companyStatus","periodLabel":"2026H1","kind":"legacy_context"}},
    {"id":"companystatus_4","metric":"companystatus_4","value":null,"rawValue":"截至6月底总资产505.15亿元、归母净资产381.61亿元，合并负债79.84亿元、资产负债率约15.80%。低杠杆增强周期下行时的生存能力，但不能消除铝价波动。","textValue":"截至6月底总资产505.15亿元、归母净资产381.61亿元，合并负债79.84亿元、资产负债率约15.80%。低杠杆增强周期下行时的生存能力，但不能消除铝价波动。","unit":"source_text","currency":null,"period":{"kind":"instant","start":null,"end":"2026-10-25"},"basis":{"scope":"legacy_as_stated","accountingStandard":"unknown","adjustment":"unknown","shareBasis":"unknown"},"nature":"legacy_claim","verification":"unreviewed","precision":"as_reported","missingReason":null,"sourceRefs":[{"sourceId":"legacy-project-XSHE.000807-20261025","locator":"/companyStatus/4"}],"notes":"归档截止日不是财务报告期；实际期间原文见dimensions.periodLabel。未复核原件，不自动用作估值参数。","dimensions":{"label":"companyStatus","periodLabel":"2026H1","kind":"legacy_context"}},
    {"id":"industrystatus_0","metric":"industrystatus_0","value":null,"rawValue":"国内电解铝产能约束和高能源门槛形成供给纪律，但铝价仍由全球库存、地产、汽车、电网、出口和海外新产能共同决定。","textValue":"国内电解铝产能约束和高能源门槛形成供给纪律，但铝价仍由全球库存、地产、汽车、电网、出口和海外新产能共同决定。","unit":"source_text","currency":null,"period":{"kind":"instant","start":null,"end":"2026-10-25"},"basis":{"scope":"legacy_as_stated","accountingStandard":"unknown","adjustment":"unknown","shareBasis":"unknown"},"nature":"legacy_claim","verification":"unreviewed","precision":"as_reported","missingReason":null,"sourceRefs":[{"sourceId":"legacy-project-XSHE.000807-20261025","locator":"/industryStatus/0"}],"notes":"归档截止日不是财务报告期；实际期间原文见dimensions.periodLabel。未复核原件，不自动用作估值参数。","dimensions":{"label":"industryStatus","periodLabel":"2026H1","kind":"legacy_context"}},
    {"id":"industrystatus_1","metric":"industrystatus_1","value":null,"rawValue":"云南水电资源帮助降低碳排放、提供绿色铝客户价值；枯水期供电、市场化电价和极端天气也可能改变成本和利用率。","textValue":"云南水电资源帮助降低碳排放、提供绿色铝客户价值；枯水期供电、市场化电价和极端天气也可能改变成本和利用率。","unit":"source_text","currency":null,"period":{"kind":"instant","start":null,"end":"2026-10-25"},"basis":{"scope":"legacy_as_stated","accountingStandard":"unknown","adjustment":"unknown","shareBasis":"unknown"},"nature":"legacy_claim","verification":"unreviewed","precision":"as_reported","missingReason":null,"sourceRefs":[{"sourceId":"legacy-project-XSHE.000807-20261025","locator":"/industryStatus/1"}],"notes":"归档截止日不是财务报告期；实际期间原文见dimensions.periodLabel。未复核原件，不自动用作估值参数。","dimensions":{"label":"industryStatus","periodLabel":"2026H1","kind":"legacy_context"}},
    {"id":"industrystatus_2","metric":"industrystatus_2","value":null,"rawValue":"氧化铝、预焙阳极等原料与电力的价格会改变单吨利润。报告不把上半年高毛利率、88%绿色用电比例直接当作长期溢价或稳定超额利润。","textValue":"氧化铝、预焙阳极等原料与电力的价格会改变单吨利润。报告不把上半年高毛利率、88%绿色用电比例直接当作长期溢价或稳定超额利润。","unit":"source_text","currency":null,"period":{"kind":"instant","start":null,"end":"2026-10-25"},"basis":{"scope":"legacy_as_stated","accountingStandard":"unknown","adjustment":"unknown","shareBasis":"unknown"},"nature":"legacy_claim","verification":"unreviewed","precision":"as_reported","missingReason":null,"sourceRefs":[{"sourceId":"legacy-project-XSHE.000807-20261025","locator":"/industryStatus/2"}],"notes":"归档截止日不是财务报告期；实际期间原文见dimensions.periodLabel。未复核原件，不自动用作估值参数。","dimensions":{"label":"industryStatus","periodLabel":"2026H1","kind":"legacy_context"}}
  ]
}
