{
  "schemaVersion": "1.0",
  "snapshotId": "XHKG.02020__operating__20261025-legacy-v1",
  "securityId": "XHKG.02020",
  "dataset": "operating",
  "asOf": "2026-10-25",
  "collectedAt": "2026-10-25",
  "acceptance": "accepted",
  "createdBy": "codex/legacy-archive",
  "supersedes": null,
  "notes": "仅接受归档结构及可追溯性；所有观测仍unreviewed。period是归档观察日而非财务期；原期间见dimensions，未经原件复核不得称新事实。",
  "observations": [
    {"id":"fact_3d0353c732ec","metric":"fact_3d0353c732ec","value":"130","rawValue":"130天","textValue":"130天","unit":"days","currency":null,"period":{"kind":"instant","start":null,"end":"2026-10-25"},"basis":{"scope":"legacy_as_stated","accountingStandard":"unknown","adjustment":"unknown","shareBasis":"unknown"},"nature":"legacy_claim","verification":"unreviewed","precision":"as_reported","missingReason":null,"sourceRefs":[{"sourceId":"legacy-project-XHKG.02020-20261025","locator":"/facts/8"}],"notes":"归档截止日不是财务报告期；实际期间原文见dimensions.periodLabel。未复核原件，不自动用作估值参数。","dimensions":{"label":"库存周转天数","periodLabel":"2026H1","originalIndex":"8","originalRow":"[\"库存周转天数\",\"130天\",\"2026H1\",\"同比减少6天；仍需结合品牌和地区结构\"]","scopeNote":"同比减少6天；仍需结合品牌和地区结构","kind":"fact_row","reportedUnit":"天","scale":"0"}},
    {"id":"companystatus_0","metric":"companystatus_0","value":null,"rawValue":"2026H1收入435.07亿元人民币，同比增长12.9%；毛利率63.9%，同比提升0.5个百分点；经营溢利117.60亿元，同比增长16.1%，经营溢利率升至27.0%。","textValue":"2026H1收入435.07亿元人民币，同比增长12.9%；毛利率63.9%，同比提升0.5个百分点；经营溢利117.60亿元，同比增长16.1%，经营溢利率升至27.0%。","unit":"source_text","currency":null,"period":{"kind":"instant","start":null,"end":"2026-10-25"},"basis":{"scope":"legacy_as_stated","accountingStandard":"unknown","adjustment":"unknown","shareBasis":"unknown"},"nature":"legacy_claim","verification":"unreviewed","precision":"as_reported","missingReason":null,"sourceRefs":[{"sourceId":"legacy-project-XHKG.02020-20261025","locator":"/companyStatus/0"}],"notes":"归档截止日不是财务报告期；实际期间原文见dimensions.periodLabel。未复核原件，不自动用作估值参数。","dimensions":{"label":"companyStatus","periodLabel":"2026H1","kind":"legacy_context"}},
    {"id":"companystatus_1","metric":"companystatus_1","value":null,"rawValue":"安踏、FILA、所有其他品牌收入分别为177.71亿元、150.45亿元和106.91亿元，同比分别增长4.8%、6.1%和44.2%。其他品牌高增包含DESCENTE、KOLON SPORT经营增长及JACK WOLFSKIN并表贡献，不能全部视作有机增长。","textValue":"安踏、FILA、所有其他品牌收入分别为177.71亿元、150.45亿元和106.91亿元，同比分别增长4.8%、6.1%和44.2%。其他品牌高增包含DESCENTE、KOLON SPORT经营增长及JACK WOLFSKIN并表贡献，不能全部视作有机增长。","unit":"source_text","currency":null,"period":{"kind":"instant","start":null,"end":"2026-10-25"},"basis":{"scope":"legacy_as_stated","accountingStandard":"unknown","adjustment":"unknown","shareBasis":"unknown"},"nature":"legacy_claim","verification":"unreviewed","precision":"as_reported","missingReason":null,"sourceRefs":[{"sourceId":"legacy-project-XHKG.02020-20261025","locator":"/companyStatus/1"}],"notes":"归档截止日不是财务报告期；实际期间原文见dimensions.periodLabel。未复核原件，不自动用作估值参数。","dimensions":{"label":"companyStatus","periodLabel":"2026H1","kind":"legacy_context"}},
    {"id":"companystatus_2","metric":"companystatus_2","value":null,"rawValue":"股东应占溢利94.87亿元包含Amer Sports配售带来的15.49亿元一次性稀释利得。剔除该利得、但保留Amer Sports经常性权益法利润后，比较口径股东应占溢利79.38亿元，同比增长12.9%；长期模型不资本化一次性利得。","textValue":"股东应占溢利94.87亿元包含Amer Sports配售带来的15.49亿元一次性稀释利得。剔除该利得、但保留Amer Sports经常性权益法利润后，比较口径股东应占溢利79.38亿元，同比增长12.9%；长期模型不资本化一次性利得。","unit":"source_text","currency":null,"period":{"kind":"instant","start":null,"end":"2026-10-25"},"basis":{"scope":"legacy_as_stated","accountingStandard":"unknown","adjustment":"unknown","shareBasis":"unknown"},"nature":"legacy_claim","verification":"unreviewed","precision":"as_reported","missingReason":null,"sourceRefs":[{"sourceId":"legacy-project-XHKG.02020-20261025","locator":"/companyStatus/2"}],"notes":"归档截止日不是财务报告期；实际期间原文见dimensions.periodLabel。未复核原件，不自动用作估值参数。","dimensions":{"label":"companyStatus","periodLabel":"2026H1","kind":"legacy_context"}},
    {"id":"companystatus_3","metric":"companystatus_3","value":null,"rawValue":"半年经营现金流130.81亿元、资本开支14.53亿元、公司披露自由现金流116.30亿元。6月底现金、定期存款及已抵押存款合计626.01亿元，借贷234.88亿元，净现金391.13亿元。","textValue":"半年经营现金流130.81亿元、资本开支14.53亿元、公司披露自由现金流116.30亿元。6月底现金、定期存款及已抵押存款合计626.01亿元，借贷234.88亿元，净现金391.13亿元。","unit":"source_text","currency":null,"period":{"kind":"instant","start":null,"end":"2026-10-25"},"basis":{"scope":"legacy_as_stated","accountingStandard":"unknown","adjustment":"unknown","shareBasis":"unknown"},"nature":"legacy_claim","verification":"unreviewed","precision":"as_reported","missingReason":null,"sourceRefs":[{"sourceId":"legacy-project-XHKG.02020-20261025","locator":"/companyStatus/3"}],"notes":"归档截止日不是财务报告期；实际期间原文见dimensions.periodLabel。未复核原件，不自动用作估值参数。","dimensions":{"label":"companyStatus","periodLabel":"2026H1","kind":"legacy_context"}},
    {"id":"companystatus_4","metric":"companystatus_4","value":null,"rawValue":"拟以15.055亿欧元、约122.78亿元人民币收购PUMA 29.06%股权，完成后按权益法核算。中国经营者集中审查已获无条件批准，但截至研究日仍应等待其他交割条件和公司完成公告；交易将显著消耗净现金并考验跨国品牌修复能力。","textValue":"拟以15.055亿欧元、约122.78亿元人民币收购PUMA 29.06%股权，完成后按权益法核算。中国经营者集中审查已获无条件批准，但截至研究日仍应等待其他交割条件和公司完成公告；交易将显著消耗净现金并考验跨国品牌修复能力。","unit":"source_text","currency":null,"period":{"kind":"instant","start":null,"end":"2026-10-25"},"basis":{"scope":"legacy_as_stated","accountingStandard":"unknown","adjustment":"unknown","shareBasis":"unknown"},"nature":"legacy_claim","verification":"unreviewed","precision":"as_reported","missingReason":null,"sourceRefs":[{"sourceId":"legacy-project-XHKG.02020-20261025","locator":"/companyStatus/4"}],"notes":"归档截止日不是财务报告期；实际期间原文见dimensions.periodLabel。未复核原件，不自动用作估值参数。","dimensions":{"label":"companyStatus","periodLabel":"2026H1","kind":"legacy_context"}},
    {"id":"companystatus_5","metric":"companystatus_5","value":null,"rawValue":"2029年零息欧元可转债尚有15亿欧元本金，9月转换价调整为97.78港元；若悉数转换，潜在新增约1.2509亿股，相当于当前已发行股数约4.5%。模型未预先计入该稀释，需单独跟踪。","textValue":"2029年零息欧元可转债尚有15亿欧元本金，9月转换价调整为97.78港元；若悉数转换，潜在新增约1.2509亿股，相当于当前已发行股数约4.5%。模型未预先计入该稀释，需单独跟踪。","unit":"source_text","currency":null,"period":{"kind":"instant","start":null,"end":"2026-10-25"},"basis":{"scope":"legacy_as_stated","accountingStandard":"unknown","adjustment":"unknown","shareBasis":"unknown"},"nature":"legacy_claim","verification":"unreviewed","precision":"as_reported","missingReason":null,"sourceRefs":[{"sourceId":"legacy-project-XHKG.02020-20261025","locator":"/companyStatus/5"}],"notes":"归档截止日不是财务报告期；实际期间原文见dimensions.periodLabel。未复核原件，不自动用作估值参数。","dimensions":{"label":"companyStatus","periodLabel":"2026H1","kind":"legacy_context"}},
    {"id":"industrystatus_0","metric":"industrystatus_0","value":null,"rawValue":"运动用品兼具功能消费与品牌消费属性。长期需求受健康意识、运动参与和产品创新支持，但鞋服潮流变化快，品牌必须持续投入研发、赞助、渠道和库存管理，不能把高毛利全部视作可自由分配现金。","textValue":"运动用品兼具功能消费与品牌消费属性。长期需求受健康意识、运动参与和产品创新支持，但鞋服潮流变化快，品牌必须持续投入研发、赞助、渠道和库存管理，不能把高毛利全部视作可自由分配现金。","unit":"source_text","currency":null,"period":{"kind":"instant","start":null,"end":"2026-10-25"},"basis":{"scope":"legacy_as_stated","accountingStandard":"unknown","adjustment":"unknown","shareBasis":"unknown"},"nature":"legacy_claim","verification":"unreviewed","precision":"as_reported","missingReason":null,"sourceRefs":[{"sourceId":"legacy-project-XHKG.02020-20261025","locator":"/industryStatus/0"}],"notes":"归档截止日不是财务报告期；实际期间原文见dimensions.periodLabel。未复核原件，不自动用作估值参数。","dimensions":{"label":"industryStatus","periodLabel":"2026H1","kind":"legacy_context"}},
    {"id":"industrystatus_1","metric":"industrystatus_1","value":null,"rawValue":"行业头部公司通过品牌矩阵覆盖不同价格带与运动场景。多品牌可以分散单一品牌老化风险，也会增加收购价格、人才激励、渠道冲突和全球整合难度；规模只有转化为库存周转、门店效率和投入资本回报才有价值。","textValue":"行业头部公司通过品牌矩阵覆盖不同价格带与运动场景。多品牌可以分散单一品牌老化风险，也会增加收购价格、人才激励、渠道冲突和全球整合难度；规模只有转化为库存周转、门店效率和投入资本回报才有价值。","unit":"source_text","currency":null,"period":{"kind":"instant","start":null,"end":"2026-10-25"},"basis":{"scope":"legacy_as_stated","accountingStandard":"unknown","adjustment":"unknown","shareBasis":"unknown"},"nature":"legacy_claim","verification":"unreviewed","precision":"as_reported","missingReason":null,"sourceRefs":[{"sourceId":"legacy-project-XHKG.02020-20261025","locator":"/industryStatus/1"}],"notes":"归档截止日不是财务报告期；实际期间原文见dimensions.periodLabel。未复核原件，不自动用作估值参数。","dimensions":{"label":"industryStatus","periodLabel":"2026H1","kind":"legacy_context"}},
    {"id":"industrystatus_2","metric":"industrystatus_2","value":null,"rawValue":"中国市场已从开店扩张转向店效、产品和消费者运营竞争。海外扩张带来更长跑道，也引入汇率、贸易、当地渠道和品牌文化风险，不能把国内成功机制无条件复制到全球。","textValue":"中国市场已从开店扩张转向店效、产品和消费者运营竞争。海外扩张带来更长跑道，也引入汇率、贸易、当地渠道和品牌文化风险，不能把国内成功机制无条件复制到全球。","unit":"source_text","currency":null,"period":{"kind":"instant","start":null,"end":"2026-10-25"},"basis":{"scope":"legacy_as_stated","accountingStandard":"unknown","adjustment":"unknown","shareBasis":"unknown"},"nature":"legacy_claim","verification":"unreviewed","precision":"as_reported","missingReason":null,"sourceRefs":[{"sourceId":"legacy-project-XHKG.02020-20261025","locator":"/industryStatus/2"}],"notes":"归档截止日不是财务报告期；实际期间原文见dimensions.periodLabel。未复核原件，不自动用作估值参数。","dimensions":{"label":"industryStatus","periodLabel":"2026H1","kind":"legacy_context"}}
  ]
}
