{
  "schemaVersion": "1.0",
  "snapshotId": "XSHE.002223__financials__20260930__20261025-mx-v1",
  "securityId": "XSHE.002223",
  "dataset": "financials",
  "asOf": "2026-09-30",
  "collectedAt": "2026-10-25",
  "acceptance": "accepted",
  "createdBy": "workbuddy/mx-q3-supplement-20261025",
  "supersedes": null,
  "notes": "鱼跃医疗2026年三季报（1-9月累计）关键财务数据，妙想服务商口径；vendor_rounded表示亿级显示舍入；不改变网站投影与模型假设。",
  "observations": [
    {
      "id": "revenue_9m_2026",
      "metric": "revenue",
      "value": "6611000000",
      "rawValue": "66.11亿元",
      "unit": "currency",
      "currency": "CNY",
      "period": {
        "kind": "duration",
        "start": "2026-01-01",
        "end": "2026-09-30"
      },
      "basis": {
        "scope": "consolidated",
        "accountingStandard": "PRC_CAS",
        "adjustment": "none",
        "shareBasis": "not_applicable"
      },
      "nature": "historical_fact",
      "verification": "provider_reported",
      "precision": "vendor_rounded",
      "missingReason": null,
      "sourceRefs": [
        {
          "sourceId": "mx-20261025-a220a433",
          "locator": "鱼跃医疗(002223)；2026三季报；营业总收入"
        }
      ],
      "notes": "2026年1-9月累计营业总收入，合并报表，中国企业会计准则。"
    },
    {
      "id": "net_profit_parent_9m_2026",
      "metric": "net_profit_parent",
      "value": "1131000000",
      "rawValue": "11.31亿元",
      "unit": "currency",
      "currency": "CNY",
      "period": {
        "kind": "duration",
        "start": "2026-01-01",
        "end": "2026-09-30"
      },
      "basis": {
        "scope": "consolidated",
        "accountingStandard": "PRC_CAS",
        "adjustment": "none",
        "shareBasis": "attributable_to_parent"
      },
      "nature": "historical_fact",
      "verification": "provider_reported",
      "precision": "vendor_rounded",
      "missingReason": null,
      "sourceRefs": [
        {
          "sourceId": "mx-20261025-a220a433",
          "locator": "鱼跃医疗(002223)；2026三季报；归属于母公司股东的净利润"
        }
      ],
      "notes": "2026年1-9月累计归母净利润。"
    },
    {
      "id": "adjusted_net_profit_parent_9m_2026",
      "metric": "adjusted_net_profit_parent",
      "value": "1037000000",
      "rawValue": "10.37亿元",
      "unit": "currency",
      "currency": "CNY",
      "period": {
        "kind": "duration",
        "start": "2026-01-01",
        "end": "2026-09-30"
      },
      "basis": {
        "scope": "consolidated",
        "accountingStandard": "PRC_CAS",
        "adjustment": "excluding_non_recurring",
        "shareBasis": "attributable_to_parent"
      },
      "nature": "historical_fact",
      "verification": "provider_reported",
      "precision": "vendor_rounded",
      "missingReason": null,
      "sourceRefs": [
        {
          "sourceId": "mx-20261025-8f6fc31b",
          "locator": "鱼跃医疗(002223)；2026三季报；扣除非经常性损益后归属于母公司股东的净利润"
        }
      ],
      "notes": "扣非口径按服务商披露列示，未另行复核调整桥接。"
    },
    {
      "id": "operating_cash_flow_9m_2026",
      "metric": "operating_cash_flow",
      "value": "1158000000",
      "rawValue": "11.58亿元",
      "unit": "currency",
      "currency": "CNY",
      "period": {
        "kind": "duration",
        "start": "2026-01-01",
        "end": "2026-09-30"
      },
      "basis": {
        "scope": "consolidated",
        "accountingStandard": "PRC_CAS",
        "adjustment": "none",
        "shareBasis": "not_applicable"
      },
      "nature": "historical_fact",
      "verification": "provider_reported",
      "precision": "vendor_rounded",
      "missingReason": null,
      "sourceRefs": [
        {
          "sourceId": "mx-20261025-8f6fc31b",
          "locator": "鱼跃医疗(002223)；2026三季报；经营活动产生的现金流量净额"
        }
      ],
      "notes": "现金流量表经营活动净额，2026年1-9月累计。"
    }
  ]
}
