{
  "schemaVersion": "1.0",
  "snapshotId": "XSHG.600887__dividends__20261025-legacy-v1",
  "securityId": "XSHG.600887",
  "dataset": "dividends",
  "asOf": "2026-10-25",
  "collectedAt": "2026-10-25",
  "acceptance": "accepted",
  "createdBy": "codex/legacy-archive",
  "supersedes": null,
  "notes": "仅接受归档结构及可追溯性；所有观测仍unreviewed。period是归档观察日而非财务期；原期间见dimensions，未经原件复核不得称新事实。",
  "observations": [
    {"id":"dividend_commentary","metric":"dividend_commentary","value":null,"rawValue":"基准75%起点对应78.75亿元年度现金分配，参考2025实际87.29亿元量级。研究模型不是董事会承诺，悲观70%不等于已符合任何公司政策最低金额，若现金压力和政策冲突应重新核对而非默认额外融资。历史每股1.38元不再计入未来收益。","textValue":"基准75%起点对应78.75亿元年度现金分配，参考2025实际87.29亿元量级。研究模型不是董事会承诺，悲观70%不等于已符合任何公司政策最低金额，若现金压力和政策冲突应重新核对而非默认额外融资。历史每股1.38元不再计入未来收益。","unit":"source_text","currency":null,"period":{"kind":"instant","start":null,"end":"2026-10-25"},"basis":{"scope":"legacy_as_stated","accountingStandard":"unknown","adjustment":"unknown","shareBasis":"unknown"},"nature":"legacy_claim","verification":"unreviewed","precision":"as_reported","missingReason":null,"sourceRefs":[{"sourceId":"legacy-project-XSHG.600887-20261025","locator":"/dividendView"}],"notes":"归档截止日不是财务报告期；实际期间原文见dimensions.periodLabel。未复核原件，不自动用作估值参数。","dimensions":{"label":"分红口径与研究说明","periodLabel":"2026H1","kind":"research_commentary"}}
  ]
}
