{
  "schemaVersion": "1.0",
  "snapshotId": "XSHE.000792__financials__20260930__20261031-q3-v1",
  "securityId": "XSHE.000792",
  "dataset": "financials",
  "asOf": "2026-09-30",
  "collectedAt": "2026-10-31",
  "acceptance": "accepted",
  "createdBy": "codex/20261031-q3-batch5",
  "supersedes": null,
  "notes": "2026年第三季度报告（未经审计）主要会计数据；合并口径、人民币；来自妙想金融数据（东方财富数据链）接口，东方财富/牧原股份/中远海控/盐湖股份/三七互娱已调取公告原文核对。 因同一控制下企业合并追溯调整，2025年同期为调整后口径（归母47.03亿元，调整前45.03亿元）。前三季89.40亿元已超基准85亿元，但基准为跨周期中枢，维持不调参。 不覆盖20261025-legacy-v1快照。",
  "observations": [
    {
      "id": "revenue_9m",
      "metric": "revenue",
      "value": "18985000000",
      "rawValue": "189.85亿元",
      "unit": "currency",
      "currency": "CNY",
      "period": {
        "kind": "duration",
        "start": "2026-01-01",
        "end": "2026-09-30"
      },
      "basis": {
        "scope": "consolidated",
        "accountingStandard": "CAS",
        "adjustment": "as_reported",
        "shareBasis": "not_applicable"
      },
      "nature": "historical_fact",
      "verification": "provider_reported",
      "precision": "as_reported",
      "missingReason": null,
      "sourceRefs": [
        {
          "sourceId": "q3-000792-20261031",
          "locator": "2026年第三季度报告；营业收入"
        }
      ],
      "notes": "同比+58.37%；未经审计。2025年同期为追溯调整后口径。",
      "dimensions": {
        "kind": "fact_row",
        "label": "收入 / 归母 / 扣非",
        "periodLabel": "2026Q3累计",
        "originalIndex": "100",
        "originalRow": "[\"收入 / 归母 / 扣非\",\"189.85 / 89.4 / 87.74亿元\",\"2026Q3累计\",\"同比+58.37% / +90.09% / +88.36%；未经审计\"]",
        "reportedUnit": "亿元",
        "scale": "8"
      }
    },
    {
      "id": "operating_cash_flow_9m",
      "metric": "operating_cash_flow",
      "value": "9839000000",
      "rawValue": "98.39亿元",
      "unit": "currency",
      "currency": "CNY",
      "period": {
        "kind": "duration",
        "start": "2026-01-01",
        "end": "2026-09-30"
      },
      "basis": {
        "scope": "consolidated",
        "accountingStandard": "CAS",
        "adjustment": "as_reported",
        "shareBasis": "not_applicable"
      },
      "nature": "historical_fact",
      "verification": "provider_reported",
      "precision": "as_reported",
      "missingReason": null,
      "sourceRefs": [
        {
          "sourceId": "q3-000792-20261031",
          "locator": "2026年第三季度报告；经营活动产生的现金流量净额"
        }
      ],
      "notes": "同比+7.59%；未经审计。",
      "dimensions": {
        "kind": "fact_row",
        "label": "经营现金流净额",
        "periodLabel": "2026Q3累计",
        "originalIndex": "101",
        "originalRow": "[\"经营现金流净额\",\"98.39亿元\",\"2026Q3累计\",\"同比+7.59%；未经审计\"]",
        "reportedUnit": "亿元",
        "scale": "8"
      }
    },
    {
      "id": "eps_basic_9m",
      "metric": "eps_basic",
      "value": "1.6895",
      "rawValue": "1.6895元",
      "unit": "currency_per_share",
      "currency": "CNY",
      "period": {
        "kind": "duration",
        "start": "2026-01-01",
        "end": "2026-09-30"
      },
      "basis": {
        "scope": "consolidated",
        "accountingStandard": "CAS",
        "adjustment": "as_reported",
        "shareBasis": "weighted_average"
      },
      "nature": "historical_fact",
      "verification": "provider_reported",
      "precision": "as_reported",
      "missingReason": null,
      "sourceRefs": [
        {
          "sourceId": "q3-000792-20261031",
          "locator": "2026年第三季度报告；基本每股收益"
        }
      ],
      "notes": "同比+90.09%；未经审计。",
      "dimensions": {
        "kind": "fact_row",
        "label": "基本每股收益",
        "periodLabel": "2026Q3累计",
        "originalIndex": "102",
        "originalRow": "[\"基本每股收益\",\"1.6895元\",\"2026Q3累计\",\"同比+90.09%；未经审计\"]",
        "reportedUnit": "元",
        "scale": "0"
      }
    },
    {
      "id": "net_profit_parent_9m",
      "metric": "net_profit_parent",
      "value": "8940000000",
      "rawValue": "89.4亿元",
      "unit": "currency",
      "currency": "CNY",
      "period": {
        "kind": "duration",
        "start": "2026-01-01",
        "end": "2026-09-30"
      },
      "basis": {
        "scope": "consolidated",
        "accountingStandard": "CAS",
        "adjustment": "as_reported",
        "shareBasis": "not_applicable"
      },
      "nature": "historical_fact",
      "verification": "provider_reported",
      "precision": "as_reported",
      "missingReason": null,
      "sourceRefs": [
        {
          "sourceId": "q3-000792-20261031",
          "locator": "2026年第三季度报告；归属于母公司股东的净利润"
        }
      ],
      "notes": "同比+90.09%；未经审计。"
    },
    {
      "id": "adjusted_net_profit_parent_9m",
      "metric": "adjusted_net_profit_parent",
      "value": "8774000000",
      "rawValue": "87.74亿元",
      "unit": "currency",
      "currency": "CNY",
      "period": {
        "kind": "duration",
        "start": "2026-01-01",
        "end": "2026-09-30"
      },
      "basis": {
        "scope": "consolidated",
        "accountingStandard": "CAS",
        "adjustment": "excluding_non_recurring",
        "shareBasis": "not_applicable"
      },
      "nature": "historical_fact",
      "verification": "provider_reported",
      "precision": "as_reported",
      "missingReason": null,
      "sourceRefs": [
        {
          "sourceId": "q3-000792-20261031",
          "locator": "2026年第三季度报告；扣除非经常性损益后归母净利润"
        }
      ],
      "notes": "同比+88.36%；未经审计。"
    }
  ]
}
