{
  "schemaVersion": "1.0",
  "snapshotId": "XHKG.01910__quotes__20261030__20261031-q3-v1",
  "securityId": "XHKG.01910",
  "dataset": "quotes",
  "asOf": "2026-10-30",
  "collectedAt": "2026-10-31",
  "acceptance": "accepted",
  "createdBy": "codex/20261031-q3-batch6",
  "supersedes": null,
  "notes": "行情刷新（本批只刷行情，财务与财报期维持原状）。收盘价、PE(TTM)、PB、总市值与已发行普通股来自妙想金融数据（东方财富数据链）；PE/PB为供应商TTM口径，不是正常化利润估值；股本为供应商近似值，不替换模型使用的精确股数。",
  "observations": [
    {
      "id": "close",
      "metric": "close",
      "value": "12.92",
      "rawValue": "12.92",
      "unit": "currency_per_share",
      "currency": "HKD",
      "period": {
        "kind": "instant",
        "start": null,
        "end": "2026-10-30"
      },
      "basis": {
        "scope": "provider_defined_issuer",
        "accountingStandard": "provider_defined",
        "adjustment": "unadjusted",
        "shareBasis": "provider_defined"
      },
      "nature": "historical_fact",
      "verification": "provider_reported",
      "precision": "as_reported",
      "missingReason": null,
      "sourceRefs": [
        {
          "sourceId": "q3quote-01910-20261031",
          "locator": "2026-10-30收盘价"
        }
      ],
      "notes": "不复权收盘价（港元），作为研究价格的刷新基准。"
    },
    {
      "id": "pe_ttm",
      "metric": "pe_ttm",
      "value": "8.663",
      "rawValue": "8.663",
      "unit": "times",
      "currency": null,
      "period": {
        "kind": "instant",
        "start": null,
        "end": "2026-10-30"
      },
      "basis": {
        "scope": "provider_defined_issuer",
        "accountingStandard": "provider_defined",
        "adjustment": "not_applicable",
        "shareBasis": "provider_defined"
      },
      "nature": "historical_fact",
      "verification": "provider_reported",
      "precision": "as_reported",
      "missingReason": null,
      "sourceRefs": [
        {
          "sourceId": "q3quote-01910-20261031",
          "locator": "市盈率PE(TTM)"
        }
      ],
      "notes": "供应商TTM口径，含周期与非经常项目，不等于正常化估值。"
    },
    {
      "id": "pb",
      "metric": "pb",
      "value": "1.49",
      "rawValue": "1.49",
      "unit": "times",
      "currency": null,
      "period": {
        "kind": "instant",
        "start": null,
        "end": "2026-10-30"
      },
      "basis": {
        "scope": "provider_defined_issuer",
        "accountingStandard": "provider_defined",
        "adjustment": "not_applicable",
        "shareBasis": "provider_defined"
      },
      "nature": "historical_fact",
      "verification": "provider_reported",
      "precision": "as_reported",
      "missingReason": null,
      "sourceRefs": [
        {
          "sourceId": "q3quote-01910-20261031",
          "locator": "市净率"
        }
      ],
      "notes": "供应商口径市净率。"
    },
    {
      "id": "market_cap",
      "metric": "market_cap",
      "value": "17620000000",
      "rawValue": "176.2亿港元",
      "unit": "currency",
      "currency": "HKD",
      "period": {
        "kind": "instant",
        "start": null,
        "end": "2026-10-30"
      },
      "basis": {
        "scope": "provider_defined_issuer",
        "accountingStandard": "provider_defined",
        "adjustment": "unadjusted",
        "shareBasis": "provider_defined"
      },
      "nature": "historical_fact",
      "verification": "provider_reported",
      "precision": "vendor_rounded",
      "missingReason": null,
      "sourceRefs": [
        {
          "sourceId": "q3quote-01910-20261031",
          "locator": "总市值"
        }
      ],
      "notes": "供应商口径总市值。"
    },
    {
      "id": "shares_outstanding",
      "metric": "shares_outstanding",
      "value": "1364000000",
      "rawValue": "13.64亿股",
      "unit": "shares",
      "currency": null,
      "period": {
        "kind": "instant",
        "start": null,
        "end": "2026-10-30"
      },
      "basis": {
        "scope": "provider_defined_issuer",
        "accountingStandard": "provider_defined",
        "adjustment": "unadjusted",
        "shareBasis": "provider_defined"
      },
      "nature": "historical_fact",
      "verification": "provider_reported",
      "precision": "vendor_rounded",
      "missingReason": null,
      "sourceRefs": [
        {
          "sourceId": "q3quote-01910-20261031",
          "locator": "已发行普通股"
        }
      ],
      "notes": "供应商近似值，不替换模型使用的精确股数。"
    }
  ]
}
