{
  "schemaVersion": "1.0",
  "snapshotId": "XSHG.600690__operating__20261025-legacy-v1",
  "securityId": "XSHG.600690",
  "dataset": "operating",
  "asOf": "2026-10-25",
  "collectedAt": "2026-10-25",
  "acceptance": "accepted",
  "createdBy": "codex/legacy-archive",
  "supersedes": null,
  "notes": "仅接受归档结构及可追溯性；所有观测仍unreviewed。period是归档观察日而非财务期；原期间见dimensions，未经原件复核不得称新事实。",
  "observations": [
    {"id":"companystatus_0","metric":"companystatus_0","value":null,"rawValue":"H1收入1,521.15亿元、归母103.16亿元、扣非92.99亿元，均低于上年同期；扣非降幅更大，盈利修复不能只看归母表面。","textValue":"H1收入1,521.15亿元、归母103.16亿元、扣非92.99亿元，均低于上年同期；扣非降幅更大，盈利修复不能只看归母表面。","unit":"source_text","currency":null,"period":{"kind":"instant","start":null,"end":"2026-10-25"},"basis":{"scope":"legacy_as_stated","accountingStandard":"unknown","adjustment":"unknown","shareBasis":"unknown"},"nature":"legacy_claim","verification":"unreviewed","precision":"as_reported","missingReason":null,"sourceRefs":[{"sourceId":"legacy-project-XSHG.600690-20261025","locator":"/companyStatus/0"}],"notes":"归档截止日不是财务报告期；实际期间原文见dimensions.periodLabel。未复核原件，不自动用作估值参数。","dimensions":{"label":"companyStatus","periodLabel":"2026H1","kind":"legacy_context"}},
    {"id":"companystatus_1","metric":"companystatus_1","value":null,"rawValue":"经营现金97.52亿元减购建43.67亿元约53.85亿元，仍需扣利息、租赁、少数股东和必要债务现金；金融投资支付和赎回不全是生产性资本开支。","textValue":"经营现金97.52亿元减购建43.67亿元约53.85亿元，仍需扣利息、租赁、少数股东和必要债务现金；金融投资支付和赎回不全是生产性资本开支。","unit":"source_text","currency":null,"period":{"kind":"instant","start":null,"end":"2026-10-25"},"basis":{"scope":"legacy_as_stated","accountingStandard":"unknown","adjustment":"unknown","shareBasis":"unknown"},"nature":"legacy_claim","verification":"unreviewed","precision":"as_reported","missingReason":null,"sourceRefs":[{"sourceId":"legacy-project-XSHG.600690-20261025","locator":"/companyStatus/1"}],"notes":"归档截止日不是财务报告期；实际期间原文见dimensions.periodLabel。未复核原件，不自动用作估值参数。","dimensions":{"label":"companyStatus","periodLabel":"2026H1","kind":"legacy_context"}},
    {"id":"companystatus_2","metric":"companystatus_2","value":null,"rawValue":"2025年度含中期现金分配比例约55%，末期调整后每股0.89151元于2026年7月实施。2026H1中报利润分配预案为无，不能虚构新增中期派息。","textValue":"2025年度含中期现金分配比例约55%，末期调整后每股0.89151元于2026年7月实施。2026H1中报利润分配预案为无，不能虚构新增中期派息。","unit":"source_text","currency":null,"period":{"kind":"instant","start":null,"end":"2026-10-25"},"basis":{"scope":"legacy_as_stated","accountingStandard":"unknown","adjustment":"unknown","shareBasis":"unknown"},"nature":"legacy_claim","verification":"unreviewed","precision":"as_reported","missingReason":null,"sourceRefs":[{"sourceId":"legacy-project-XSHG.600690-20261025","locator":"/companyStatus/2"}],"notes":"归档截止日不是财务报告期；实际期间原文见dimensions.periodLabel。未复核原件，不自动用作估值参数。","dimensions":{"label":"companyStatus","periodLabel":"2026H1","kind":"legacy_context"}},
    {"id":"industrystatus_0","metric":"industrystatus_0","value":null,"rawValue":"家电是成熟需求与更新换代结合的市场，高端化、服务网络和品牌可以提高利润，但补贴、地产和消费信心会影响销量结构。","textValue":"家电是成熟需求与更新换代结合的市场，高端化、服务网络和品牌可以提高利润，但补贴、地产和消费信心会影响销量结构。","unit":"source_text","currency":null,"period":{"kind":"instant","start":null,"end":"2026-10-25"},"basis":{"scope":"legacy_as_stated","accountingStandard":"unknown","adjustment":"unknown","shareBasis":"unknown"},"nature":"legacy_claim","verification":"unreviewed","precision":"as_reported","missingReason":null,"sourceRefs":[{"sourceId":"legacy-project-XSHG.600690-20261025","locator":"/industryStatus/0"}],"notes":"归档截止日不是财务报告期；实际期间原文见dimensions.periodLabel。未复核原件，不自动用作估值参数。","dimensions":{"label":"industryStatus","periodLabel":"2026H1","kind":"legacy_context"}},
    {"id":"industrystatus_1","metric":"industrystatus_1","value":null,"rawValue":"海外经营分散单一市场需求，也受到关税、工资、运输和汇率影响。营收规模不是护城河强度，需看区域利润和投入资本回报。","textValue":"海外经营分散单一市场需求，也受到关税、工资、运输和汇率影响。营收规模不是护城河强度，需看区域利润和投入资本回报。","unit":"source_text","currency":null,"period":{"kind":"instant","start":null,"end":"2026-10-25"},"basis":{"scope":"legacy_as_stated","accountingStandard":"unknown","adjustment":"unknown","shareBasis":"unknown"},"nature":"legacy_claim","verification":"unreviewed","precision":"as_reported","missingReason":null,"sourceRefs":[{"sourceId":"legacy-project-XSHG.600690-20261025","locator":"/industryStatus/1"}],"notes":"归档截止日不是财务报告期；实际期间原文见dimensions.periodLabel。未复核原件，不自动用作估值参数。","dimensions":{"label":"industryStatus","periodLabel":"2026H1","kind":"legacy_context"}}
  ]
}
