{
  "schemaVersion": "1.0",
  "snapshotId": "XSHE.002594__financials__20261025-legacy-v1",
  "securityId": "XSHE.002594",
  "dataset": "financials",
  "asOf": "2026-10-25",
  "collectedAt": "2026-10-25",
  "acceptance": "accepted",
  "createdBy": "codex/legacy-archive",
  "supersedes": null,
  "notes": "仅接受归档结构及可追溯性；所有观测仍unreviewed。period是归档观察日而非财务期；原期间见dimensions，未经原件复核不得称新事实。",
  "observations": [
    {"id":"fact_174db1ded262","metric":"fact_174db1ded262","value":null,"rawValue":"3,448.15 / 123.25 / 123.73亿元","textValue":"3,448.15 / 123.25 / 123.73亿元","unit":"source_text","currency":null,"period":{"kind":"instant","start":null,"end":"2026-10-25"},"basis":{"scope":"legacy_as_stated","accountingStandard":"unknown","adjustment":"unknown","shareBasis":"unknown"},"nature":"legacy_claim","verification":"unreviewed","precision":"as_reported","missingReason":null,"sourceRefs":[{"sourceId":"legacy-project-XSHE.002594-20261025","locator":"/facts/3"}],"notes":"归档截止日不是财务报告期；实际期间原文见dimensions.periodLabel。未复核原件，不自动用作估值参数。","dimensions":{"label":"收入 / 归母 / 扣非","periodLabel":"2026H1","originalIndex":"3","originalRow":"[\"收入 / 归母 / 扣非\",\"3,448.15 / 123.25 / 123.73亿元\",\"2026H1\",\"中报印刷页7，人民币\"]","scopeNote":"中报印刷页7，人民币","kind":"fact_row"}},
    {"id":"fact_388ed4dacf5a","metric":"fact_388ed4dacf5a","value":null,"rawValue":"373.35 / 447.03亿元","textValue":"373.35 / 447.03亿元","unit":"source_text","currency":null,"period":{"kind":"instant","start":null,"end":"2026-10-25"},"basis":{"scope":"legacy_as_stated","accountingStandard":"unknown","adjustment":"unknown","shareBasis":"unknown"},"nature":"legacy_claim","verification":"unreviewed","precision":"as_reported","missingReason":null,"sourceRefs":[{"sourceId":"legacy-project-XSHE.002594-20261025","locator":"/facts/4"}],"notes":"归档截止日不是财务报告期；实际期间原文见dimensions.periodLabel。未复核原件，不自动用作估值参数。","dimensions":{"label":"合并经营现金 / 购建支付","periodLabel":"2026H1","originalIndex":"4","originalRow":"[\"合并经营现金 / 购建支付\",\"373.35 / 447.03亿元\",\"2026H1\",\"中报印刷页71，原表单位千元\"]","scopeNote":"中报印刷页71，原表单位千元","kind":"fact_row"}},
    {"id":"fact_f44f2ac96d48","metric":"fact_f44f2ac96d48","value":"181268000000","rawValue":"1,812.68亿元 / 21.71%","textValue":"1,812.68亿元 / 21.71%","unit":"currency","currency":"CNY","period":{"kind":"instant","start":null,"end":"2026-10-25"},"basis":{"scope":"legacy_as_stated","accountingStandard":"unknown","adjustment":"unknown","shareBasis":"unknown"},"nature":"legacy_claim","verification":"unreviewed","precision":"as_reported","missingReason":null,"sourceRefs":[{"sourceId":"legacy-project-XSHE.002594-20261025","locator":"/facts/5"}],"notes":"归档截止日不是财务报告期；实际期间原文见dimensions.periodLabel。未复核原件，不自动用作估值参数。","dimensions":{"label":"境外收入 / 毛利率","periodLabel":"2026H1","originalIndex":"5","originalRow":"[\"境外收入 / 毛利率\",\"1,812.68亿元 / 21.71%\",\"2026H1\",\"中报印刷页26，集团口径\"]","scopeNote":"中报印刷页26，集团口径","kind":"fact_row","reportedUnit":"亿元","scale":"8"}},
    {"id":"fact_8dad51baf592","metric":"fact_8dad51baf592","value":"9117197565","rawValue":"91.17197565亿股","textValue":"91.17197565亿股","unit":"shares","currency":null,"period":{"kind":"instant","start":null,"end":"2026-10-25"},"basis":{"scope":"legacy_as_stated","accountingStandard":"unknown","adjustment":"unknown","shareBasis":"unknown"},"nature":"legacy_claim","verification":"unreviewed","precision":"as_reported","missingReason":null,"sourceRefs":[{"sourceId":"legacy-project-XSHE.002594-20261025","locator":"/facts/6"}],"notes":"归档截止日不是财务报告期；实际期间原文见dimensions.periodLabel。未复核原件，不自动用作估值参数。","dimensions":{"label":"普通股数","periodLabel":"2026H1","originalIndex":"6","originalRow":"[\"普通股数\",\"91.17197565亿股\",\"2026H1\",\"2025送转后A/H合计，不是旧30亿股\"]","scopeNote":"2025送转后A/H合计，不是旧30亿股","kind":"fact_row","reportedUnit":"亿股","scale":"8"}},
    {"id":"fact_fcfd3ee7c468","metric":"fact_fcfd3ee7c468","value":null,"rawValue":"约556.2 / 1,373亿元","textValue":"约556.2 / 1,373亿元","unit":"source_text","currency":null,"period":{"kind":"instant","start":null,"end":"2026-10-25"},"basis":{"scope":"legacy_as_stated","accountingStandard":"unknown","adjustment":"unknown","shareBasis":"unknown"},"nature":"legacy_claim","verification":"unreviewed","precision":"as_reported","missingReason":null,"sourceRefs":[{"sourceId":"legacy-project-XSHE.002594-20261025","locator":"/facts/7"}],"notes":"归档截止日不是财务报告期；实际期间原文见dimensions.periodLabel。未复核原件，不自动用作估值参数。","dimensions":{"label":"现金及等价物 / 带息债务","periodLabel":"2026H1","originalIndex":"7","originalRow":"[\"现金及等价物 / 带息债务\",\"约556.2 / 1,373亿元\",\"2026H1\",\"妙想财务，债务并非全部负债\"]","scopeNote":"妙想财务，债务并非全部负债","kind":"fact_row"}}
  ]
}
